idproducto,texto,url,nombre
MPE1085662184,"Xiaomi Redmi Note 15 Lte 256gb/8gb - Purpura. Rating promedio: 4.6/5 basado en 22 reseñas. Reseñas: Al segundo día de uso después de haber recibidor mi redmi note 15 4g si ninguna novedad, está funcionando muy bien y hasta el momento es un buen producto.
La crítica que tengo es que tardó un semana en llegar a mis manos. | Batería: la batería me dura más de 12 horas con uso moderado.
Pantalla: la pantalla se ve muy bien incluso de día.
Es uno de los mejores teléfonos precio calidad por su cámara y su pantalla. | Diseño: bonito.
Cámara: para su precio están muy buenas.
Excelente teléfono para el costo. Lo único que queda algo justo sería su procesador. Pero por lo demás todo bien. | Muy bueno y a excelente precio. | Muy buen celular, y la relación calidad precio es excelente. | Buen producto, como recien nuevo no le puedo dar 5 estrella en que tan duradero es, lo demás perfecto. | Pantalla: exelente brillo, bien fluido.
Cámara: fotos decentes para el precio.
Un buen celular, para los que buscan algo cómodo, bonito y practico. | Estoy satisfecho con mi compra, si bien tengo poco tiempo con este teléfono, este ha superado mis expectativas y ha sido una gran mejora a la hora de navegar por internet sin mencionar su gran capacidad de almacenamiento e ram.",https://articulo.mercadolibre.com.pe/MPE-1085662184,Xiaomi Redmi Note 15 Lte 256gb/8gb - Purpura
MPE1085750336,"Smartphone Xiaomi Redmi Note 15 4G 6gb 128gb Amoled 6.77 Cámara 108mp púrpura. Rating promedio: 4.6/5 basado en 22 reseñas. Reseñas: Al segundo día de uso después de haber recibidor mi redmi note 15 4g si ninguna novedad, está funcionando muy bien y hasta el momento es un buen producto.
La crítica que tengo es que tardó un semana en llegar a mis manos. | Batería: la batería me dura más de 12 horas con uso moderado.
Pantalla: la pantalla se ve muy bien incluso de día.
Es uno de los mejores teléfonos precio calidad por su cámara y su pantalla. | Diseño: bonito.
Cámara: para su precio están muy buenas.
Excelente teléfono para el costo. Lo único que queda algo justo sería su procesador. Pero por lo demás todo bien. | Muy bueno y a excelente precio. | Muy buen celular, y la relación calidad precio es excelente. | Buen producto, como recien nuevo no le puedo dar 5 estrella en que tan duradero es, lo demás perfecto. | Pantalla: exelente brillo, bien fluido.
Cámara: fotos decentes para el precio.
Un buen celular, para los que buscan algo cómodo, bonito y practico. | Estoy satisfecho con mi compra, si bien tengo poco tiempo con este teléfono, este ha superado mis expectativas y ha sido una gran mejora a la hora de navegar por internet sin mencionar su gran capacidad de almacenamiento e ram.",https://articulo.mercadolibre.com.pe/MPE-1085750336,Smartphone Xiaomi Redmi Note 15 4G 6gb 128gb Amoled 6.77 Cámara 108mp púrpura
MPE1086101790,"Smartphone Honor Magic7 Lite 8gb+512gb Dual Sim Color Negro. Rating promedio: 4.7/5 basado en 74 reseñas. Reseñas: Un bonito celular y se le ve bastante resistente , para mi madre encaja muy bien por la batería y la capacidad de almacenamiento, perfecto para su trabajo. La cámara no es su fuerte pero se defiende con el precio calidad , pero si es una buena opción si buscas un celular con buena batería 🔋. | La duración de la batería es increíble, buena fluidez y la calidad de cámara no decepciona, incluye cargador y una funda transparente. | Buen teléfono, su batería es brutal aunque la cámara no es la gran cods. | Excelente equipo. Multifuncional. Buenas funciones. | Nuevo y sellado. | Muy buen equipo. La pantalla es bastante buena y la batería excelente. | Diseño: bien.
Cámara: buena.
Es bueno. | Cámara: tiene lo necesario.
Buen celular para su costo.",https://articulo.mercadolibre.com.pe/MPE-1086101790,Smartphone Honor Magic7 Lite 8gb+512gb Dual Sim Color Negro
MPE1086102314,"Apple 2026 Macbook Neo (de 13 Pulgadas, Chip A18 Pro De Apple Con Cpu De 6 Núcleos Y Gpu De 5 Núcleos, 8gb Memoria Unificada, 512 gb) - Índigo. Rating promedio: 5.0/5 basado en 11 reseñas. Reseñas: La macbook llegó en perfectas condiciones y en el tiempo establecido por la app. | La caja llegó un poco dañada pero el contenido intacto. | Excelente producto calidad-precio. | Excelente producto! la caja llegó en un estado 8/10 pero el producto estaba increíble. Muchas gracias. | La amo y el color índigo es precioso, elegante, fino y la macbook la tengo hace dos días uso para configurarla y aún no la he cargado. Estupenda compra. | El producto llegó impecable, muy recomendado. | Muy bien producto llegó rápido.",https://articulo.mercadolibre.com.pe/MPE-1086102314,"Apple 2026 Macbook Neo (de 13 Pulgadas, Chip A18 Pro De Apple Con Cpu De 6 Núcleos Y Gpu De 5 Núcleos, 8gb Memoria Unificada, 512 gb) - Índigo"
MPE1086102992,"Apple iPhone 17 Pro Max (512 GB) - Azul profundo - Sólo eSIM. Rating promedio: 5.0/5 basado en 14 reseñas. Reseñas: Batería: dura bastante lo compré en septiembre y literal recién de tanto uso va en 98%.
Pantalla: muy buen brillo, nitidez y la fluidez de los videos.
Es bueno el producto, dura bastante la batería pero bastante solamente lo cargo una vez al día y dura bastante. | Muy bueno. Solo que es esim. | Excelente cámara y batería. | Es original, llegó muy rápido. | Producto original y sellado. | Batería: todo bien.
Pantalla: todo original.
Producto original. | Todo bien. Recomendado. | Productor orginial 💯.",https://articulo.mercadolibre.com.pe/MPE-1086102992,Apple iPhone 17 Pro Max (512 GB) - Azul profundo - Sólo eSIM
MPE1086140002,"Teléfono celular Xiaomi Redmi Note 15 4G Dual Sim 128/6gb Ram negro negro. Rating promedio: 5.0/5 basado en 2 reseñas. Reseñas: Funciona excelente. | Batería: dura aproximadamente 1 día de uso constante.
Diseño: de peso liviano.",https://articulo.mercadolibre.com.pe/MPE-1086140002,Teléfono celular Xiaomi Redmi Note 15 4G Dual Sim 128/6gb Ram negro negro
MPE1086231312,Samsung Galaxy S22+ (Snapdragon) 5G 128 GB white 8 GB RAM - Excelente (Reacondicionado). Rating promedio: 5.0/5 basado en 1 reseñas. Reseñas: El equipo esta bueno sin fallas trabaja con normalidad.,https://articulo.mercadolibre.com.pe/MPE-1086231312,Samsung Galaxy S22+ (Snapdragon) 5G 128 GB white 8 GB RAM - Excelente (Reacondicionado)
MPE1086387542,"Xiaomi Redmi Note 15 Dual Sim 256 Gb Púrpura 8 Gb de RAM. Rating promedio: 5.0/5 basado en 13 reseñas. Reseñas: Lo que destaco más en este celular, es la bateria durando mas de 12 horas y un poco más dependiendo tambien del uso. Su sistema es bien optimizado. Es muy fluido con el uso diario, ya que es mi unico celular principal. La cámara en demasiado nitida, buenas fotos. La carga rapida lo hace en 30 minutos hasta el 80% y hasta el 100% unos 40 a 45 minutos aprox. 1000% recomiendo este celular. | Buenas relación calidad - precio.
Falta mejorar la conectividad porque es 4g. | Todo bien con el producto, completamente sellado , acorde a las características descritas. | Es muy bueno y a un excelente precio, lo único malo son sus bordes redondeados porque no pueden ser protegidos por la funda y ya se me hizo una marca en uno de sus bordes de la pantalla. | Todo muy bien con la compra. | Buen celular, llegó súper protegido, el material es muy bueno. Buena cámara, buen zoom. | Excelente celular. Tal y cual se describe. | Buen celular, pero es muy molesto qué en todas las aplicaciones trae anuncios, xiami debería de quita esos anuncios para tener una mejor experiencia, para uso normal el celular responde bien, pero si es para una mayor exigencia en su uso no lo recomendaria.",https://articulo.mercadolibre.com.pe/MPE-1086387542,Xiaomi Redmi Note 15 Dual Sim 256 Gb Púrpura 8 Gb de RAM
MPE1086543110,"Xiaomi Redmi Note 15 Pro+ 5g 512gb/12gb - Mocha Brown. Rating promedio: 4.8/5 basado en 6 reseñas. Reseñas: Una buena opción para ser gama. Media 👌. | Excelente equipo, buena pantalla y durabilidad de bateria. | Pantalla: excelente calidad de brillo.
Batería: larga duración de bateria.
Burna relación precio producto. | Buena cámara, decente táctil y cómodo rendimiento a la hora de jugar wr o ver videos por horas. | Excelente teléfono de gama media, muy completo, fácil de usar, super amigable y la cámara fotográfica es de lo mejor que tiene tanto para fotografias y vídeos en hd. De los mejores productos redmi note (xiaomi) que he usado hasta la fecha.",https://articulo.mercadolibre.com.pe/MPE-1086543110,Xiaomi Redmi Note 15 Pro+ 5g 512gb/12gb - Mocha Brown
MPE1086725010,"Celular Infinix Note 60 Pro 5G, 256 GB ROM, 12+12 GB RAM, Naranja Solar, Snapdragon 7s Gen 4, 6000 mAh, carga rápida 90 W, pantalla 6,78"" AMOLED 144 Hz.. Rating promedio: 5.0/5 basado en 3 reseñas. Reseñas: El producto es bueno, la atención no. | Todo conforme aunque llegó sin el cargador inalámbrico. | Excelente producto.
Empieza confiable.",https://articulo.mercadolibre.com.pe/MPE-1086725010,"Celular Infinix Note 60 Pro 5G, 256 GB ROM, 12+12 GB RAM, Naranja Solar, Snapdragon 7s Gen 4, 6000 mAh, carga rápida 90 W, pantalla 6,78"" AMOLED 144 Hz."
MPE1086818070,"Laptop Lenovo Ideapad Slim 3i 15.3 Core I5-13420h 24gb 512g Gris. Rating promedio: 5.0/5 basado en 3 reseñas. Reseñas: Cumple con lo requerido y posee una buena calidad de pantalla. | Superó mi expectativa, se nota rápida en varios procesos, la batería en promediod dura 3 horas a media demanda.",https://articulo.mercadolibre.com.pe/MPE-1086818070,Laptop Lenovo Ideapad Slim 3i 15.3 Core I5-13420h 24gb 512g Gris
MPE1086818110,Infinix GT Pro Gaming Kit GT 30 Pro 5G Dual SIM 256 GB dark flare 12 GB RAM. Rating promedio: 5.0/5 basado en 1 reseñas. Reseñas: Sin texto detallado.,https://articulo.mercadolibre.com.pe/MPE-1086818110,Infinix GT Pro Gaming Kit GT 30 Pro 5G Dual SIM 256 GB dark flare 12 GB RAM
MPE1086819336,"Celular Infinix Note 50 Pro Bioactive Halo Ai Lighting, 90 W, carga superrápida, 30 W, inalámbrico, 6,78 amoled, 144 Hz, 256 GB, 8 GB de RAM, titanio gris. Rating promedio: 4.5/5 basado en 10 reseñas. Reseñas: Gratamente sorprendido con el equipo, la calidad del equipo, la cámara, lo fluido del sistema. No soy gammer, pero para un uso cotidiano es la mejor relación calidad precio que he tenido en muchísimo tiempo. | Muy buen producto, bastante recomendado. | Se siente muy bien, de buena calidad, muy fluido, buena camara, lo unico detalle a mi agrado es que vibra el altavoz , como tiene dos salidas. Por lo demás excelente. | Cámara: muy buena camara.
Diseño: muy bien diseño. | Diseño: muy bueno agradable al tacto.
Batería: dura lo suficiente y carga muy rápido.
Es muy bueno. | Buen producto por su precio, aún lo estoy probando pero no decepciona<:. | Cámara: cuenta con ia para las fotos.
Batería: carga rápida. | Excelente producto, calidad precio.",https://articulo.mercadolibre.com.pe/MPE-1086819336,"Celular Infinix Note 50 Pro Bioactive Halo Ai Lighting, 90 W, carga superrápida, 30 W, inalámbrico, 6,78 amoled, 144 Hz, 256 GB, 8 GB de RAM, titanio gris"
MPE1086821276,"Apple iPhone 17 Pro Max (256 GB) - Color plata - Sólo eSIM. Rating promedio: 5.0/5 basado en 14 reseñas. Reseñas: Batería: dura bastante lo compré en septiembre y literal recién de tanto uso va en 98%.
Pantalla: muy buen brillo, nitidez y la fluidez de los videos.
Es bueno el producto, dura bastante la batería pero bastante solamente lo cargo una vez al día y dura bastante. | Muy bueno. Solo que es esim. | Excelente cámara y batería. | Es original, llegó muy rápido. | Producto original y sellado. | Batería: todo bien.
Pantalla: todo original.
Producto original. | Todo bien. Recomendado. | Productor orginial 💯.",https://articulo.mercadolibre.com.pe/MPE-1086821276,Apple iPhone 17 Pro Max (256 GB) - Color plata - Sólo eSIM
MPE1086835006,"Moto G86 Power 5g 8+256gb Azul. Rating promedio: 4.7/5 basado en 7 reseñas. Reseñas: Bueno equipo para el uso diario. | Muy buen equipo, satisfecho con mi compra!. | Excelente celular de gama media. | Una bestialidad de celular, lo cargas al 100 y no lo necesitar volver a tocar en 2 a 3 días. | Excelente equipo. | Batería: lo deje olvidado en mi casa todo el dia y solo se descargo 5%.",https://articulo.mercadolibre.com.pe/MPE-1086835006,Moto G86 Power 5g 8+256gb Azul
MPE1086999286,"Xiaomi Redmi Note 15 Pro+ 5g 12gb + 512gb Negro. Rating promedio: 4.5/5 basado en 15 reseñas. Reseñas: Excelente producto. | Pantalla: fabuloso genial.
Cámara: muy buenas fotos, me a sorprendido.
Si necesitas una buena camara y tu presupuesto es bajo. Este modelo será lo mejor. | Buen producto, tal cual como figura en la descripción, aun probando el s. O. Y demás funciones. Si bien es cierto la batería es de 6500, pero en acciones mínimas se descarga bastante. | Pantalla: muy buenos.
Muy práctico y cómodo. | Excelente comprador de confianza. | Recomendado buen equipo. | Pantalla: buena pantalla, solo que por el sol a veces no se ve bien los vídeos.
Batería: me dura casi dos días.
Excelente celular por el precio, da buena calidad. | Buen producto y nuevo.",https://articulo.mercadolibre.com.pe/MPE-1086999286,Xiaomi Redmi Note 15 Pro+ 5g 12gb + 512gb Negro
MPE1086999300,"Celular Xiaomi Redmi Note 15 Pro Plus 5g 512gb 12ram Café. Rating promedio: 4.8/5 basado en 6 reseñas. Reseñas: Una buena opción para ser gama. Media 👌. | Excelente equipo, buena pantalla y durabilidad de bateria. | Pantalla: excelente calidad de brillo.
Batería: larga duración de bateria.
Burna relación precio producto. | Buena cámara, decente táctil y cómodo rendimiento a la hora de jugar wr o ver videos por horas. | Excelente teléfono de gama media, muy completo, fácil de usar, super amigable y la cámara fotográfica es de lo mejor que tiene tanto para fotografias y vídeos en hd. De los mejores productos redmi note (xiaomi) que he usado hasta la fecha.",https://articulo.mercadolibre.com.pe/MPE-1086999300,Celular Xiaomi Redmi Note 15 Pro Plus 5g 512gb 12ram Café
MPE1087000990,"iPhone 13 Dual SIM 128 GB azul - Excelente (Reacondicionado). Rating promedio: 5.0/5 basado en 2 reseñas. Reseñas: Estoy muy contenta con el celu, su camara es excelente. Trabajo con redes sociales y va espectacular, rinde bastante la batería, es cuestión de saber usarlo. La condición de la batería es del 86% lo cual está muy bien. Vino con algunos raspones pero algo netamente estético. | Bien hasta el momento.",https://articulo.mercadolibre.com.pe/MPE-1087000990,iPhone 13 Dual SIM 128 GB azul - Excelente (Reacondicionado)
MPE1087037612,"Apple iPad pro 13 wi-fi , 512 gb - Negro (m4). Rating promedio: 5.0/5 basado en 6 reseñas. Reseñas: Todo ok con el producto. | Todo bien por lo que ofrecen. | Excelente, tal como lo esperaba.",https://articulo.mercadolibre.com.pe/MPE-1087037612,"Apple iPad pro 13 wi-fi , 512 gb - Negro (m4)"
MPE1087037744,"Tablet Lenovo Idea Tab Pro 8GB RAM 256 GB+ Lápiz + Teclado + Buds 12,7. Rating promedio: 4.4/5 basado en 46 reseñas. Reseñas: No es mala, pero se suele trabar y tiene fallas en muchas apps. No es nada exagerado, pero es molesto en ocasiones. | Diría la mejor calidad precio yo la compré por el cyber y la verdad es que en las semanas que la he usado genial pero en exteriores se nota la necesidad de más brillo. | Buen producto, para lo que ofrece calidad-precio. | Bueno es grandesito justo lo que esperaba. | Excelente producto. | Excelente producto lo recomiendo 👌🏻🙂. | Un equipo que cumple con todo , tiene buena autonomía , carga rápida, las respuestas en todas las aplicaciones son inmediatas, lo volvería a comprar, recomendado. | Excelente producto, la bateria es buena y la fluidez para el precio es super genial, muy satisfecho!.",https://articulo.mercadolibre.com.pe/MPE-1087037744,"Tablet Lenovo Idea Tab Pro 8GB RAM 256 GB+ Lápiz + Teclado + Buds 12,7"
MPE1087037912,"Samsung Galaxy S25 Fe 8gb Jet Black 128gb Jetblack. Rating promedio: 4.8/5 basado en 6 reseñas. Reseñas: Batería: buena duración, podría cargar un poco más rapido.
Diseño: materiales premium y muy ligero.
Es un excelente celular, muy completo en cuanto a temas de ia, one ui es una capa muy estable y el equipo recibió la última actualización al sacarlo de caja, en temas generales hasta ahora la experiencia es muy buena, la batería podría durar un poco más pero estoy satisfecho y sobretodo por el precio adquirido fue una oferta increíble. | Bueno, liviano, rápido. | Se los recomiendo. Buen producto. | Buena compra, me llegó muy bien protegido y sobre todo no me ha presentado problemas al momento de usarlo. | Diseño: elegante.
Pantalla: muy buena.
Es rápido y muy buen producto. | Me gusto el producto es bueno en termino calidad precio, pero se cslienta un poco en los primeros usos de ahi, todo bien.",https://articulo.mercadolibre.com.pe/MPE-1087037912,Samsung Galaxy S25 Fe 8gb Jet Black 128gb Jetblack
MPE1087037980,"Celular Samsung Galaxy S25 Fe White 128gb Sm-s731bzwlltp. Rating promedio: 5.0/5 basado en 9 reseñas. Reseñas: Si lo encuentras a 1900, ufff regaladazo. | Todo perfecto hasta ahora. | Excelente, nuena compra y en cuotas sin intereses. | Buen producto, llega bien y rápido. | Una compra rápida y segura, y sobre todo con facilidad de pago , sin interes. | Pantalla: buean pantalla.
Diseño: me gusta el color sobrio.
Buen celular, ligero y elegante. | Los juegos corren genial. | El producto esta perfecto. Todo muy bien.",https://articulo.mercadolibre.com.pe/MPE-1087037980,Celular Samsung Galaxy S25 Fe White 128gb Sm-s731bzwlltp
MPE1087038262,"Xiaomi Redmi Note 14 Pro Plus 5g Dual Sim 512 Gb Azul 12 Gb Ram. Rating promedio: 4.6/5 basado en 14 reseñas. Reseñas: Buenas tardes amigo, este es xiaomi redmi note 14pro +5g, y yo he pagado por un xiaomi redmi note 14 pro plus +5g. Me podría explicar o le pregunto a mercado libre. Espero su respuesta. | Le pongo 4 estrellas porque a veces habrp en needforspeed y se congela, solo por eso. Y por ultimo se tiene que se muy cuidadoso con la carga rápida. | Bueno calidad y elegancia. | Que si quieres tener un muy buen equipo este es uno de los mejores gracias. | Buen producto lo recomiendo. | Muy bueno en realción precio calidad y rendimiento. | Excelente es recomendable. | Me parece hasta el momento muy bueno el producto, cumple con todo, buena cámara, etc.",https://articulo.mercadolibre.com.pe/MPE-1087038262,Xiaomi Redmi Note 14 Pro Plus 5g Dual Sim 512 Gb Azul 12 Gb Ram
MPE1087271386,"Honor Magic 8 Pro 12 Gb 512 Gb Snapdragon 8 Elite Gen 5 7100mah Battery 200mp. Rating promedio: 5.0/5 basado en 1 reseñas. Reseñas: Batería: excelente.
Diseño: moderno.
Es un maquinon el celular.",https://articulo.mercadolibre.com.pe/MPE-1087271386,Honor Magic 8 Pro 12 Gb 512 Gb Snapdragon 8 Elite Gen 5 7100mah Battery 200mp
MPE432349636,Dock De Carga Para Samsung Sm-t700 Nuevo. Rating promedio: 5.0/5 basado en 1 reseñas. Reseñas: Todo bien. Compatible.,https://articulo.mercadolibre.com.pe/MPE-432349636,Dock De Carga Para Samsung Sm-t700 Nuevo
MPE435056530,"Cargador 12v 2.58a Microsoft Surface Pro 3 Pro 4   Tablet. Rating promedio: 5.0/5 basado en 3 reseñas. Reseñas: Tras un mes de uso, si funciona correctamente. | Todo muy bien con el producto, lo recomiendo a la comunidad. | Vino bien empaquetado, y corresponde a la descripción.",https://articulo.mercadolibre.com.pe/MPE-435056530,Cargador 12v 2.58a Microsoft Surface Pro 3 Pro 4   Tablet
MPE438128828,Lenovo Loq 15 I5-12450hx 16gb/d5 512gb/ssd Rtx3050/6gb 144hz. Rating promedio: 4.0/5 basado en 2 reseñas. Reseñas: Gracias conforme a las características indicadas. | Viene sin sistema operativo.,https://articulo.mercadolibre.com.pe/MPE-438128828,Lenovo Loq 15 I5-12450hx 16gb/d5 512gb/ssd Rtx3050/6gb 144hz
MPE439188692,"Lenovo Loq 15 I7-13700hx Rtx5050/8gb D5/16gb Ssd/1tb 144hz. Rating promedio: 5.0/5 basado en 2 reseñas. Reseñas: Me pareció excelente, solo quizá bueno que llegue de fábrica con office. | Producto recomendado.",https://articulo.mercadolibre.com.pe/MPE-439188692,Lenovo Loq 15 I7-13700hx Rtx5050/8gb D5/16gb Ssd/1tb 144hz
MPE602058767,"Celular 2g Teclas Grandes Ideal Adulto Mayor / Marcacion R.. Rating promedio: 5.0/5 basado en 3 reseñas. Reseñas: Buen producto para adulto mayor, en especial el botón sos, solo que le falta entrada de auriculares jack3. 5mm. | Buen celular ideal para mi mamá que es adulto mayor. !. | Muy sencillo de utilizar y de buena calidad.",https://articulo.mercadolibre.com.pe/MPE-602058767,Celular 2g Teclas Grandes Ideal Adulto Mayor / Marcacion R.
MPE609398357,"Acer Predator Helios Neo 16s Oled Ultra 9 Rtx5070ti 32gb 1tb. Rating promedio: 5.0/5 basado en 3 reseñas. Reseñas: Excelente producto, recomendadísimo!. | Excelente producto, recomendado!.",https://articulo.mercadolibre.com.pe/MPE-609398357,Acer Predator Helios Neo 16s Oled Ultra 9 Rtx5070ti 32gb 1tb
MPE609619289,Asus Tuf Gaming F16 2025 Ci7-14650hx 64gb 2tb Ssd Rtx5060. Rating promedio: 5.0/5 basado en 1 reseñas. Reseñas: Excelente equipo.,https://articulo.mercadolibre.com.pe/MPE-609619289,Asus Tuf Gaming F16 2025 Ci7-14650hx 64gb 2tb Ssd Rtx5060
MPE609619785,"Asus Tuf F16 2025 Ci7-14650hx 1tb Ssd 16gb Rtx5050 8gb 165hz. Rating promedio: 3.7/5 basado en 3 reseñas. Reseñas: Super recomendable!. | Esta padre. Buen producto. | Al parecer me vino con el disco duro fallado y ahora tengo problemas al prenderla, sale pantalla azul a cada rato y por lo menos tengo que reiniciarla 3 veces para poder usarla normal.
Si la uso sin cargador aparece pantalla azul y se reinicia.
No me deja usar la garantía de asus porque dice que es comprada en usa.",https://articulo.mercadolibre.com.pe/MPE-609619785,Asus Tuf F16 2025 Ci7-14650hx 1tb Ssd 16gb Rtx5050 8gb 165hz
MPE609709504,Hp Omnibook 5 Ryzen Ai 7 16gb Ram 512gb Ssd. Rating promedio: 5.0/5 basado en 1 reseñas. Reseñas: Sin texto detallado.,https://articulo.mercadolibre.com.pe/MPE-609709504,Hp Omnibook 5 Ryzen Ai 7 16gb Ram 512gb Ssd
MPE609914153,Asus Vivobook 14 Flip Ai Oled Ultra 7 256v 16gb 1tb Ssd. Rating promedio: 5.0/5 basado en 1 reseñas. Reseñas: Ninguna queja hasta el día de hoy.,https://articulo.mercadolibre.com.pe/MPE-609914153,Asus Vivobook 14 Flip Ai Oled Ultra 7 256v 16gb 1tb Ssd
MPE611803663,"Teléfono Móvil Senior Para Adulto Mayor. Rating promedio: 4.8/5 basado en 6 reseñas. Reseñas: Buen celular para un adulto mayor. | Se ve muy práctico, sobre todo los números grandes, tal como la descripción. | Buena opción para mi tía. Gracias!!. | Excelente producto. | Muy buen producto, números grandes para personas con dificultad visual, en el audio considero que debería ser más alto para que se escuche el tono de llamada estando alejados. Pero es buen producto.",https://articulo.mercadolibre.com.pe/MPE-611803663,Teléfono Móvil Senior Para Adulto Mayor
MPE612908778,"Teléfono Móvil Sapito 3g Adulto Mayor. Rating promedio: 4.0/5 basado en 1 reseñas. Reseñas: Es bueno el producto, tal vez algunas funciones podrian ser mas simples para un adulto mayor, pero en terminos generales es bueno el producto.",https://articulo.mercadolibre.com.pe/MPE-612908778,Teléfono Móvil Sapito 3g Adulto Mayor
MPE613520388,Lenovo Legion 5 2025 Core Ultra 9 Rtx5060 64gb Ram 1tb Ssd. Rating promedio: 5.0/5 basado en 1 reseñas. Reseñas: Excelente calidad-precio.,https://articulo.mercadolibre.com.pe/MPE-613520388,Lenovo Legion 5 2025 Core Ultra 9 Rtx5060 64gb Ram 1tb Ssd
MPE614528065,Laptop Lenovo Ideapad Slim 3 15.6  Fhd Ci7 16gb 1tb Ssd. Rating promedio: 4.0/5 basado en 1 reseñas. Reseñas: Buena compra cumplió con lo prometido.,https://articulo.mercadolibre.com.pe/MPE-614528065,Laptop Lenovo Ideapad Slim 3 15.6  Fhd Ci7 16gb 1tb Ssd
MPE615157105,Asus Rog Strix G18 2025 Ultra 9 275hx 32g 1tb Rtx5070ti 12gb. Rating promedio: 5.0/5 basado en 1 reseñas. Reseñas: 100% confiables.,https://articulo.mercadolibre.com.pe/MPE-615157105,Asus Rog Strix G18 2025 Ultra 9 275hx 32g 1tb Rtx5070ti 12gb
MPE615183939,Lenovo Loq 15 Core I7-13700hx 16gb 512gb Ssd Rtx 3050 144hz. Rating promedio: 5.0/5 basado en 2 reseñas. Reseñas: Para el momento todo está bien con el equipo. | Estoy probándola pero corre rápido full 👍.,https://articulo.mercadolibre.com.pe/MPE-615183939,Lenovo Loq 15 Core I7-13700hx 16gb 512gb Ssd Rtx 3050 144hz
MPE616606914,Laptop Asus Vivobook 16 Ci7-13620h 24gb 1tb Ssd Full Hd. Rating promedio: 5.0/5 basado en 2 reseñas. Reseñas: Lo único que le falta es teclado retroiluminado. | Excelente laptop para uso intensivo.,https://articulo.mercadolibre.com.pe/MPE-616606914,Laptop Asus Vivobook 16 Ci7-13620h 24gb 1tb Ssd Full Hd
MPE616921810,Asus Vivobook 16 Core I9 270h 32gb Ddr5 1tb Ssd W11 Pro 2026. Rating promedio: 5.0/5 basado en 2 reseñas. Reseñas: Hasta ahora todo bien. | Muy buen producto. Excelente relación calidad-precio.,https://articulo.mercadolibre.com.pe/MPE-616921810,Asus Vivobook 16 Core I9 270h 32gb Ddr5 1tb Ssd W11 Pro 2026
MPE616923008,"Laptop Lenovo Ideapad Slim 3, I7 16gb, 1tb Ssd, 15.6  Fhd. Rating promedio: 5.0/5 basado en 3 reseñas. Reseñas: Todo muy bien para calidad - precio lo único es que la batería me dura muy poco como 2 horas pero también la uso 8 horas al día es decir lo cargo como 4 veces es lo único pero del resto bien. | La tengo ya dos años. Es una buena maquina. La ahencia me atendio muy bien siempre. La compu esta bien equipada, rapidaprsctica. Buen tamaño. Portable. Se ve y escucha bien. La uso para hacer musica y va muy bien. (mira bien las caracteristicas en reviews antes de escojer tu laptop! todo depende el uso que quieras darle).",https://articulo.mercadolibre.com.pe/MPE-616923008,"Laptop Lenovo Ideapad Slim 3, I7 16gb, 1tb Ssd, 15.6  Fhd"
