idproducto,texto,url,nombre
MPE783955008,"Samsung Galaxy A36 5g 256gb 8gb Awesome Black. Rating promedio: 4.5/5 basado en 4 reseñas. Reseñas: Buen producto, lo recomiendo. | Batería: muy buena.
Diseño: muy buenos materiales.
Es un buen equipo gama media, me sorprendió su desempeño en términos generales. | Es lo que uno espera por un samsung, si bien la calidad de la camara no es tan competente como un a56 o superior, este no se queda atrás y para quienes no usan muchas aplicaciones en continuo, osea, uso cotidiano y nada de gaming, es un buen telefono. | Buen producto, me llegó rápido.",https://articulo.mercadolibre.com.pe/MPE-783955008,Samsung Galaxy A36 5g 256gb 8gb Awesome Black
MPE787049856,"Laptop Lenovo V15 G4 Iru Core I3-1315u, Ram 16gb, Ssd 512gb Iron Gray. Rating promedio: 5.0/5 basado en 3 reseñas. Reseñas: Tuve un problema, pero la cambiaron sin ningún problema, todo bien con la laptop. | Completamente funcional y excelente.",https://articulo.mercadolibre.com.pe/MPE-787049856,"Laptop Lenovo V15 G4 Iru Core I3-1315u, Ram 16gb, Ssd 512gb Iron Gray"
MPE796552980,"Apple iPhone 16 (128 GB) - Blanco. Rating promedio: 4.7/5 basado en 180 reseñas. Reseñas: Tienen que avisar que es con número de serie chino. No puede tener esim, no funciona apple inteligence, la cámara a veces falla en abrir. | La caja vino abollada, la caja del producto vino desgastada, pero el celular está bien, aunque si me fijé que tenía muy ligeros rayones en la pantalla principal, yo creo que estos productos son open box, el celular todo bien no me ah causado problemas y ya voy 2 semanas usando todo original americano con el apple inteligente, aunque sinceramente muchos bug el ios 26, luego todo lo demás está bien, sellado. | El celular me pareció muy bueno, tanto materiales como el color del equipo. | Me tocó la vers. Americana :) de momento todo va bien. | Todo perfecto, tiene apple intelligence y ningún bloqueante. Es de geografía vietnamita jajaja. | Todo excelente, versión americana. | Está lindo, funciona perfectamente. Solo me parece que la batería no dura muchísimo más que mi iphone 14. Pero estoy feliz y es blanco. Se ve hermoso 🥰. | Muy buen producto y a un precio razonable.",https://articulo.mercadolibre.com.pe/MPE-796552980,Apple iPhone 16 (128 GB) - Blanco
MPE799711086,"Laptop HP OmniBook 5 16-ba1051la, Intel Core i5-1334U, 16GB RAM, 512GB SSD, 16"" 2K, Windows 11 Home. Rating promedio: 5.0/5 basado en 1 reseñas. Reseñas: Es rápido y me ayuda en mis labores personales, la luz en el teclado es excelente.",https://articulo.mercadolibre.com.pe/MPE-799711086,"Laptop HP OmniBook 5 16-ba1051la, Intel Core i5-1334U, 16GB RAM, 512GB SSD, 16"" 2K, Windows 11 Home"
MPE802597832,"Samsung Galaxy Tab S10 Fe 256 GB ROM 12 g RAM azul 10,9"". Rating promedio: 5.0/5 basado en 4 reseñas. Reseñas: Todo funciona bien. | Llegó bien, sin problemas. | El producto llegó en perfectas condiciones. Sus empaques, folletos y demás estuvieron intactos. Además, la tablet funciona de maravilla.",https://articulo.mercadolibre.com.pe/MPE-802597832,"Samsung Galaxy Tab S10 Fe 256 GB ROM 12 g RAM azul 10,9"""
MPE802688932,"Samsung Galaxy Tab S10 Fe Azul Color Blue. Rating promedio: 4.9/5 basado en 12 reseñas. Reseñas: Excelente producto, el empaque un poco descuidado pero por dentro tod ok!!. | Tiene muy buena pantalla, buen sonido, para mi uso basico de streaming, tiktok, leer mangas/comics, juegos ocasionales como brawl stars, call of duty, bleach soul resonance y demas juegos, solo es poner bien la configuracion.
Funciona bien con varias apps en segundo plano y su modo escritorio, pero claro tampoco lo exigiras tan extremo, está muy bien optimizado. Su bateria tambien le dura mucho, solo decir que es algo pesada, pero te acostumbras, hasta ahora no se a trabado ni nada. | Excelente producto. | Llevo 4 meses con esta tablet y es perfecta. Me gusta mucho. | Producto muy bueno para ofimática casual, muy recomendado si eres estudiante. Una herramienta bastante útil. | El producto llegó dentro de la fecha estimada y no hubieron problemas. | Me encanta esta tablet, super funcional. | Muy buena, es muy funcional me ayuda mucho.",https://articulo.mercadolibre.com.pe/MPE-802688932,Samsung Galaxy Tab S10 Fe Azul Color Blue
MPE802690922,"iPad 10ª Generación A2696 10.9"" 64GB rosa 4GB de memoria RAM. Rating promedio: 4.8/5 basado en 11 reseñas. Reseñas: Buen producto lo único es que la caja vino un poco dañada por lo demás excelente. | Es un excelente ipad con una buena pantalla amplia de buena resolución. | Bueno quiero conseguir un protector de pantalla y protector para mi ipad. | Tal cual los detalles, 100% confiable. | El producto esta super bien , lo malo fue que la caja estaba medio golpeada pero todo bien , es buena compra. | Excelente, nuevo y totalmente sellado. | Excelente producto, no esperaba menos de apple.",https://articulo.mercadolibre.com.pe/MPE-802690922,"iPad 10ª Generación A2696 10.9"" 64GB rosa 4GB de memoria RAM"
MPE802714962,"Logitech Astro A50 Gen5, Diadema Gamer Lightspeed Color Negro. Rating promedio: 5.0/5 basado en 1 reseñas. Reseñas: Sin texto detallado.",https://articulo.mercadolibre.com.pe/MPE-802714962,"Logitech Astro A50 Gen5, Diadema Gamer Lightspeed Color Negro"
MPE802742572,"Laptop Legion Pro 7i Ultra 9 Rtx 507012gb 32gb 2tb 16 240 Hz. Rating promedio: 5.0/5 basado en 1 reseñas. Reseñas: Es una bestia en traje, combina muy bien el rendimiento robusto y la apariencia elegante, mejor legion visto hasta el momento, 100% recomendado.",https://articulo.mercadolibre.com.pe/MPE-802742572,Laptop Legion Pro 7i Ultra 9 Rtx 507012gb 32gb 2tb 16 240 Hz
MPE802818882,"Samsung Galaxy Tab S10 Fe Sm-x520 - 10,9' Ram 12gb/rom 256gb. Rating promedio: 5.0/5 basado en 4 reseñas. Reseñas: Todo funciona bien. | Llegó bien, sin problemas. | El producto llegó en perfectas condiciones. Sus empaques, folletos y demás estuvieron intactos. Además, la tablet funciona de maravilla.",https://articulo.mercadolibre.com.pe/MPE-802818882,"Samsung Galaxy Tab S10 Fe Sm-x520 - 10,9' Ram 12gb/rom 256gb"
MPE802820002,"Tablet Lenovo Yoga Tab Plus, 12.7 , 256gb, 16gb, Android. Rating promedio: 5.0/5 basado en 1 reseñas. Reseñas: La tablet cumple con lo que ofrece y más. Es muy útil, potente, y sus parlantes, una maravilla. Muy útil para trabajar, leer. Los reviews de internet, youtube, etc son lo que prometen. Solo consejo: ponle película protectora a la pantalla, en un viaje, el teclado se aplastó en la pantalla (estaba en la mochila) y le hizo ligeras marcas que no se perciben, pero igual te molestará que la pantalla no esté 100% presentable.",https://articulo.mercadolibre.com.pe/MPE-802820002,"Tablet Lenovo Yoga Tab Plus, 12.7 , 256gb, 16gb, Android"
MPE802822190,"Apple iPhone 14 Pro (1 TB) - Negro espacial. Rating promedio: 4.9/5 basado en 8 reseñas. Reseñas: En la características decía con nano sim, pero es con esim, fuera de eso sin problema 👌🏼. | Me encanta, la cámara es magnífica y el diseño ni hablar, por estas cosas soy iphone lover. | Excelente producto. | Excelente compra.",https://articulo.mercadolibre.com.pe/MPE-802822190,Apple iPhone 14 Pro (1 TB) - Negro espacial
MPE804134282,"Tablet Advance Prime Pr5850 7 1024x600 Dual Sim 3g 16gb 1gb Color Negro. Rating promedio: 4.0/5 basado en 9 reseñas. Reseñas: Producto básico. | Excelente producto. | El producto esta bien. | Para un estudiante de primaria/secundaria y no sea tan exigente, esta muy bien para el precio que tiene. | Aunque yo sé que no tiene la opción de encendido y apagado automáticamente, y es android 8,se que es un buen producto.
¿cuál es la capacidad máxima para colocar una tarjeta microsd?. | No la compren, lentisima. Bueno, no podia esperar mucho por el precio, pero ni eso vale 👌🏻. | No sirve , muy lenta.",https://articulo.mercadolibre.com.pe/MPE-804134282,Tablet Advance Prime Pr5850 7 1024x600 Dual Sim 3g 16gb 1gb Color Negro
MPE804235730,"Samsung Galaxy Tab S10 Fe Gris Color Gray. Rating promedio: 4.9/5 basado en 12 reseñas. Reseñas: Excelente producto, el empaque un poco descuidado pero por dentro tod ok!!. | Tiene muy buena pantalla, buen sonido, para mi uso basico de streaming, tiktok, leer mangas/comics, juegos ocasionales como brawl stars, call of duty, bleach soul resonance y demas juegos, solo es poner bien la configuracion.
Funciona bien con varias apps en segundo plano y su modo escritorio, pero claro tampoco lo exigiras tan extremo, está muy bien optimizado. Su bateria tambien le dura mucho, solo decir que es algo pesada, pero te acostumbras, hasta ahora no se a trabado ni nada. | Excelente producto. | Llevo 4 meses con esta tablet y es perfecta. Me gusta mucho. | Producto muy bueno para ofimática casual, muy recomendado si eres estudiante. Una herramienta bastante útil. | El producto llegó dentro de la fecha estimada y no hubieron problemas. | Me encanta esta tablet, super funcional. | Muy buena, es muy funcional me ayuda mucho.",https://articulo.mercadolibre.com.pe/MPE-804235730,Samsung Galaxy Tab S10 Fe Gris Color Gray
MPE804326624,"Tablet Samsung Galaxy Tab S10 Fe 8gb Ram 128gb 10.9 Pulgadas Azul. Rating promedio: 4.5/5 basado en 22 reseñas. Reseñas: Muy buena tablet, les recomiendo comprarla con una mica de vidrio y ponersela en cuanto la saquen, la pantalla no tiene gorila armor si se cae pueden tener serios problemas más allá de eso conforme con mi compra. | Es una buena tablet, aunque siento que la batería se baja rápido, pero es muy funcional. | La tablet samsung s10 fe es rápida y tiene una buena resolución, voy por la tercera semana de uso. Equipo llegó totalmente sellado. | Lo compre porque los comentarios decía que venía con proyector y no me vino nada solo la tablet en su caja. | Excelente tablet. Para mi que la uso para el trabajo 10 de 10. | Muy contento. Muchas gracias. | Muy buen producto. | Original, está good, me encanta 🤩.",https://articulo.mercadolibre.com.pe/MPE-804326624,Tablet Samsung Galaxy Tab S10 Fe 8gb Ram 128gb 10.9 Pulgadas Azul
MPE806981792,"Xiaomi Redmi Note 14 Pro 5g Negro 256gb 8ram 200mpx. Rating promedio: 4.6/5 basado en 76 reseñas. Reseñas: No mando el color que pedi. | Producto no conforme / no funciona correctamente.
El equipo presenta bloqueo por osiptel.
El imei no figura en lista blanca y está asociado a viettel.
En perú un equipo así no puede usarse.
Solicito devolución o cambio inmediato. | Aun no lo pruebo, pero seguro sale bueno como cada xiaomi que he tenido. | Excelente compra, muchas gracias. | Aún lo tengo en observación, pero hasta el momento todo bien. 👍🏼. | El celular es excelente, muy buena taza de refresco, no se traba, super fluido el celular. | Diseño: agradable.
Batería: duradera. | Muy bonito diseño, buena camara, todo ok.",https://articulo.mercadolibre.com.pe/MPE-806981792,Xiaomi Redmi Note 14 Pro 5g Negro 256gb 8ram 200mpx
MPE810124158,"OnePlus 12 Dual SIM 512 GB negro 16 GB RAM. Rating promedio: 5.0/5 basado en 1 reseñas. Reseñas: La mejor compra que realicé, 10 de 10.",https://articulo.mercadolibre.com.pe/MPE-810124158,OnePlus 12 Dual SIM 512 GB negro 16 GB RAM
MPE813855968,"Laptop Lenovo Legion 5 Oled Core I7 14700hx 32gb 2tb Rtx5060. Rating promedio: 5.0/5 basado en 1 reseñas. Reseñas: Super recomendados, feliz con mi laptop.",https://articulo.mercadolibre.com.pe/MPE-813855968,Laptop Lenovo Legion 5 Oled Core I7 14700hx 32gb 2tb Rtx5060
MPE815363008,"Sony Audífonos Inalámbricos Noise Cancelling WH-1000xm6 Negro. Rating promedio: 4.4/5 basado en 32 reseñas. Reseñas: Me encantó todo lo de estos audífonos, pero no se compren la opción en gris, no sé qué le pasa a las almohadillas que se ensucian demasiado fácil, quizá en los otros colores también, pero al ser oscuros no se notan, acá claramente se ven que están sucios. Cabe recalcar que no es por un tema de higiene porque en reviews también lo vi. Todo lo demás me parece perfecto, son los mejores audífonos que pude haber comprado porque son cómodos, excelente calidad de sonido, muy buena cancelación de sonido y se pueden llevar a todas partes. | Excelente producto, lo recomiendo. | Excelente! súper recomendado!. | Excelente producto se recomienda comprar 💯 original. | Excelente calidad. | Comodidad: buen peso.
De los mejores audifonos a la fecha precio calidad. | Que está súper bueno el volumen la calidad de audio. | Excelente calidad de sonido.",https://articulo.mercadolibre.com.pe/MPE-815363008,Sony Audífonos Inalámbricos Noise Cancelling WH-1000xm6 Negro
MPE815429002,"Celular Xiaomi Redmi Note 14 Pro 256gb 8gb ram negro potente cámara avanzada. Rating promedio: 4.5/5 basado en 60 reseñas. Reseñas: Teléfono + cargador + una carcasa de goma. | Me bloquearon el imeil1. | Muy buena relación calidad precio. | La pantalla es bastante buena al igual que su rendimiento para juegos y otros usos pero su cámara delantera y trasera es un 5/10 bastante normal. | 10/10 recomendado al principio dude pero ahora estoy satisfecho. | Todo bien con el celular, lo único es que se baja el brillo de la pantalla cuando la luz del día le ingresa por los lados. | Muy bueno el celular en relación calidad precio, tiene características altas para el precio y viene con una funda para la protección, excelente. | Buen producto, para mis que haceres diario.",https://articulo.mercadolibre.com.pe/MPE-815429002,Celular Xiaomi Redmi Note 14 Pro 256gb 8gb ram negro potente cámara avanzada
MPE816821030,"Audifono Samsung Galaxy Buds Core White SM-R410NZWALTA. Rating promedio: 5.0/5 basado en 3 reseñas. Reseñas: Aislamiento: bastante buena la cancelación de ruido.
Sonido: neutros a más no poder.
Los materiales son lo justo y necesario, la conectividad con mi teléfono samsung fue súper cómodo, el audio es lo más neutro que encontrarás, no resalten casi nada e irónicamente eso me gustó.",https://articulo.mercadolibre.com.pe/MPE-816821030,Audifono Samsung Galaxy Buds Core White SM-R410NZWALTA
MPE816832350,"Tablet Xiaomi Pad 7 - Pantalla 3.2k 11.2'', Snapdragon 7+ Gen 3, 8gb Ram, 256gb, Batería 8850mah, Carga Rápida 45w. Rating promedio: 5.0/5 basado en 3 reseñas. Reseñas: El producto me parece excelente por lo que ofrece, si bien ya sabía mucho de las especificaciones técnicas del producto, me sorprende porque tiene cosas que no sabía y estoy poco a poco, sacándole todo el potencial, estoy contento. | Excelente producto. | Satisfecho con el producto.",https://articulo.mercadolibre.com.pe/MPE-816832350,"Tablet Xiaomi Pad 7 - Pantalla 3.2k 11.2'', Snapdragon 7+ Gen 3, 8gb Ram, 256gb, Batería 8850mah, Carga Rápida 45w"
MPE816834752,"Xiaomi Redmi Note 14 Pro 4G negro 8GB RAM 256GB 200MP cámara pantalla grande batería potente. Rating promedio: 4.4/5 basado en 54 reseñas. Reseñas: La pantalla y la camara son una locura. 🗣️🔥🔥🔥. | Puntual y buen producto. | Hasta el momento sin comentarios, pero si se califica la garantía del transporte. ⭐⭐⭐⭐⭐. | Buen celular. La pantalla luce increíble.
Su rendimiento es bastante eficiente. Calidad precio. | Bien, recomiendo. | Excelente producto. | Todo bonito, pero se confundieron en el color. | Está bonito, en buenas condiciones socio es, nuevo, sellado en caja.",https://articulo.mercadolibre.com.pe/MPE-816834752,Xiaomi Redmi Note 14 Pro 4G negro 8GB RAM 256GB 200MP cámara pantalla grande batería potente
MPE816886592,Samsung Galaxy S22 5G 256 GB phantom black 8 GB RAM - Excelente (Reacondicionado). Rating promedio: 5.0/5 basado en 1 reseñas. Reseñas: Buen celular muy elegante y sus fotos muy nítidas lo máximo.,https://articulo.mercadolibre.com.pe/MPE-816886592,Samsung Galaxy S22 5G 256 GB phantom black 8 GB RAM - Excelente (Reacondicionado)
MPE816938672,"Celular Xiaomi Redmi Note 14 Pro 256gb 8gb Ram Azul. Rating promedio: 4.7/5 basado en 47 reseñas. Reseñas: Pedí color azul, el día del delivery, me llamaron y me dijeron que no había. Iba a pedir la devolución del dinero, pero como lo necesitaba al celular, acepte en color negro. Resumen, deben decir que colores les queda. Parcialmente satisfecho. | Un hermoso celular. | Buen equipo para el precio. | Recibi pero en otro color a lo que pedi. | Excelente producto con respecto a calidad precio. | Un teléfono muy bonito me encanta. | Diseño: diseño acorde al precio.
Pantalla: buena.
Ahora mejor comprar la nueva serie. | Llegó en el tiempo indicado y todo intacto.
Conforme.",https://articulo.mercadolibre.com.pe/MPE-816938672,Celular Xiaomi Redmi Note 14 Pro 256gb 8gb Ram Azul
MPE817017120,"Celular Samsung Galaxy S23+ 256GB SM-S916BZKLLTP. Rating promedio: 4.9/5 basado en 9 reseñas. Reseñas: Fantástico equipo, la construcción se siente de un equipo realmente premium, y a pesar de contar solo con 8gb de ram, su fluidez es de primera, el equipo está muy bien optimizado y las aplicaciones propias de samsung me han agradado mucho sobre todo calendario y correo que para mi flujo de trabajo se ha convertido en un gran diferencial. | El equipo muy bien por ahora vale la pena recomendado. | Equipo potente, super fotos. Alto rendimiento va bien. | Producto nuevo original y sellado, 100% confiable. | Quizá la bateria no es tan extensa como quisiera, pero lo demás excelente. | Medio año de uso, 0 problemas, buen equipo. | Producto de calidad y a buen precio salió. Tanto así que sale tanto bueno como traerlo de afuera.",https://articulo.mercadolibre.com.pe/MPE-817017120,Celular Samsung Galaxy S23+ 256GB SM-S916BZKLLTP
MPE817183034,"Laptop HP Gaming Victus 15-fa2012la, Intel Core i7-13620H, 16GB RAM, 1TB SSD, 15.6"", FHD, Windows 11 Home. Rating promedio: 4.0/5 basado en 1 reseñas. Reseñas: Su rendimiento es bueno, y cumple con lo necesario para realizar tareas cotidianas. Sin embargo, para juegos muy exigentes y pesados no resulta la opción adecuada.
En mi caso, que priorizó el estudio y busco momentos de distracción jugando, este equipo es ideal.
Para quienes necesitan un desempeño competitivo en videojuegos, recomiendo optar por una pc.",https://articulo.mercadolibre.com.pe/MPE-817183034,"Laptop HP Gaming Victus 15-fa2012la, Intel Core i7-13620H, 16GB RAM, 1TB SSD, 15.6"", FHD, Windows 11 Home"
MPE818379008,"Xiaomi Redmi Note 14 Pro Plus 5g Morado 256gb 8ram 200mpx. Rating promedio: 4.6/5 basado en 75 reseñas. Reseñas: Brutalmente honesto, por el precio está muy bien, un diseño muy moderno, la única camara muy buena es la principal, la frontal y restantes son normalitas por no decir malas, carga en 30 minutos, se me calentó rápido eso si al inicio con todas las actualizaciones. | Por el precio es buen producto. La batería se descarga rápidamente, pero el cargador de 120w ayuda mucho, en 10 min puedes cargar 30% aprox. A veces se pone algo lento en la respuesta. | Llwgó sellado, todo nuevo. Perfecto. | Excelente producto. | Producto de buena calidad, tal cual indicaba las especificaciones. | Muy buen equipo buena memoria y muy rápido para juegos y aplicaciones. | Es un poco más pesado del celular que tenía antes, pero es manejable, el color es agradable, a veces genera un poco de molestia la pantalla por ser redondeada en los bordes. | Buena compra y buen precio. Recomendado.",https://articulo.mercadolibre.com.pe/MPE-818379008,Xiaomi Redmi Note 14 Pro Plus 5g Morado 256gb 8ram 200mpx
MPE818379010,"Celular Xiaomi Redmi Note 14 Pro + 5g Dual Sim 256 Gb Azul 8 Gb Ram. Rating promedio: 4.6/5 basado en 75 reseñas. Reseñas: Brutalmente honesto, por el precio está muy bien, un diseño muy moderno, la única camara muy buena es la principal, la frontal y restantes son normalitas por no decir malas, carga en 30 minutos, se me calentó rápido eso si al inicio con todas las actualizaciones. | Por el precio es buen producto. La batería se descarga rápidamente, pero el cargador de 120w ayuda mucho, en 10 min puedes cargar 30% aprox. A veces se pone algo lento en la respuesta. | Llwgó sellado, todo nuevo. Perfecto. | Excelente producto. | Producto de buena calidad, tal cual indicaba las especificaciones. | Muy buen equipo buena memoria y muy rápido para juegos y aplicaciones. | Es un poco más pesado del celular que tenía antes, pero es manejable, el color es agradable, a veces genera un poco de molestia la pantalla por ser redondeada en los bordes. | Buena compra y buen precio. Recomendado.",https://articulo.mercadolibre.com.pe/MPE-818379010,Celular Xiaomi Redmi Note 14 Pro + 5g Dual Sim 256 Gb Azul 8 Gb Ram
MPE818964668,"Auriculares Logitech Com Microfono Oficina H111 981-000612 Ajustable Gris. Rating promedio: 4.5/5 basado en 17 reseñas. Reseñas: Buenos audífonos calidad precio, sirven para usarse tanto en mando de play como en computadora. | Si es bueno es escucha bien. | Aprovechen la buena oferta, som buenos audífonos y mas por el micrófono tan bueno. | Buen sonido y comodidad. | Excelente para su precio y su necesidad 👍. | Buen producto en diseño y calidad y audio por un buen precio. Un poco apretado para cabezones. | Buen producto. Gracias. | Buenos audífonos para reuniones o para trabajo. Es cómodo pues no deja las orejas rojas y ni las aprieta demasiado, por lo que puedes usarlos por un buen tiempo. Resalta mucho por su micrófono porque es muy bueno.",https://articulo.mercadolibre.com.pe/MPE-818964668,Auriculares Logitech Com Microfono Oficina H111 981-000612 Ajustable Gris
MPE819290132,"Blackview Tab 50 8'' 4gb 128gb 2mp y 0,3mp Color Azul. Rating promedio: 4.2/5 basado en 5 reseñas. Reseñas: Excelente producto, lo recomiendo. | La compre para lectura, es muy buena, justo para tener en la mano o para llevar en un canguro, la bateria dura dias en lectura. | Muy buen producto, calidad precio. Recomendado. | Bueno, en relación precio calidad. | Producto demasiado lento al ejecuilas aplicaciones. No los recomiendo.",https://articulo.mercadolibre.com.pe/MPE-819290132,"Blackview Tab 50 8'' 4gb 128gb 2mp y 0,3mp Color Azul"
MPE819345410,"Asus Tuf Gaming F16 Core 5 210H 16gb DDR5, 512gb Rtx3050 6gb. Rating promedio: 5.0/5 basado en 1 reseñas. Reseñas: Sin texto detallado.",https://articulo.mercadolibre.com.pe/MPE-819345410,"Asus Tuf Gaming F16 Core 5 210H 16gb DDR5, 512gb Rtx3050 6gb"
MPE819369966,"Apple iPhone 15 Pro (256 GB) - Titanio Natural - Excelente (Reacondicionado). Rating promedio: 4.0/5 basado en 5 reseñas. Reseñas: Batería: muy buena.
Todo bien muy bien con el teléfono. | Buena calidad 0 detalles. | Cámara: la camara esta 10/10.
Pantalla: pantalla 10/10.
Me vino con 100% de capacidad de bateria y todo muy bien. | Está bien el iphone me vino con 87% de batería y no tenía ningún detalle respecto a algún rayón o algo pero si no me gustó como vino ya que solo le pusieron como una bolsita y en un caja sentí que se pudo maltratar pero después todo correcto , mejorar el empaque y yap. | Se reinicia solo, al día como 6 veces cada 3 horas aproximadamente.",https://articulo.mercadolibre.com.pe/MPE-819369966,Apple iPhone 15 Pro (256 GB) - Titanio Natural - Excelente (Reacondicionado)
MPE819407150,"Tablet Blackview Tab 9 WiFi 11"" 256GB+6GB RAM Gris. Rating promedio: 4.5/5 basado en 2 reseñas. Reseñas: Buen producto calidad precio.",https://articulo.mercadolibre.com.pe/MPE-819407150,"Tablet Blackview Tab 9 WiFi 11"" 256GB+6GB RAM Gris"
MPE819420254,Tablet Blackview Tab 9 Wifi 11'' 8 Core 6gb 256gb Color Azul Color Negro. Rating promedio: 4.5/5 basado en 2 reseñas. Reseñas: Buen producto calidad precio.,https://articulo.mercadolibre.com.pe/MPE-819420254,Tablet Blackview Tab 9 Wifi 11'' 8 Core 6gb 256gb Color Azul Color Negro
MPE819446174,"Tablet Blackview Tab 9 11"" 256GB gris y 18GB de memoria RAM. Rating promedio: 4.5/5 basado en 2 reseñas. Reseñas: Buen producto calidad precio.",https://articulo.mercadolibre.com.pe/MPE-819446174,"Tablet Blackview Tab 9 11"" 256GB gris y 18GB de memoria RAM"
MPE819458348,"Celular Xiaomi Redmi Note 14 256gb 8gb Ram Negro. Rating promedio: 4.5/5 basado en 23 reseñas. Reseñas: Llegó en excelente estado, antes del tiempo indicado. | Muy bueno. Es el segundo que compro para obsequiarlo. | Todo exelente por el precio, soy de arequipa acá está a más precio y lo pague con t. De crédito, exelente por ese lado grcaias. | Diseño: material plástico, buen agarre y peso ligero.
Cámara: buena resolución y funcionalidades como retocar con ai y edición.
Buen celular para el precio, definitivamente recomendable. | Buen equipo funciona correctamente. | Pantalla: buena pantalla.
Batería: gran duración. | Excelente calidad, todo sin novedad. | Llegó en buenas condiciones y rápido, lo único es que me llamaron por cambio de color pero fuera de eso bien equipo para el precio.",https://articulo.mercadolibre.com.pe/MPE-819458348,Celular Xiaomi Redmi Note 14 256gb 8gb Ram Negro
MPE819874556,"Laptop Gamer LOQ Gen 10 AMD Ryzen 7 24GB RAM 512GB SSD NVIDIA RTX 5060 16''. Rating promedio: 5.0/5 basado en 4 reseñas. Reseñas: Excelente, el producto llegó en el menor tiempo posible, y en buen estado.
La compra fue rápida y sencilla. | Muy buen producto.",https://articulo.mercadolibre.com.pe/MPE-819874556,Laptop Gamer LOQ Gen 10 AMD Ryzen 7 24GB RAM 512GB SSD NVIDIA RTX 5060 16''
MPE820316382,"Laptop Lenovo Legion 5 Gen 10 Intel Core U7 Ram 32gb Ssd 1tb. Rating promedio: 5.0/5 basado en 3 reseñas. Reseñas: Me encantó el equipo. Y todo este tiempo de prueba, corre super rápido. | Buen producto! recomendado. | Funciona perfectamente, potencia y practicidad.",https://articulo.mercadolibre.com.pe/MPE-820316382,Laptop Lenovo Legion 5 Gen 10 Intel Core U7 Ram 32gb Ssd 1tb
