idproducto,texto,url,nombre
MPE1079354022,"Motorola Razr 60 5g 512gb/ 12gb Ram Expande 24gb-blanco. Moto Ai. Cámara 50mp, 13mp, 32mp. Ip48, Sumergible, Gorilla Glass Victuss.. Rating promedio: 4.0/5 basado en 1 reseñas. Reseñas: Cámara: buena.
Pantalla: si es relativamente buena solo que en sol pues se satura.
En ocasiones la pantalla se raya nose si así vino de fabrica o pues como es plegable así es bueno en general funciona.",https://articulo.mercadolibre.com.pe/MPE-1079354022,"Motorola Razr 60 5g 512gb/ 12gb Ram Expande 24gb-blanco. Moto Ai. Cámara 50mp, 13mp, 32mp. Ip48, Sumergible, Gorilla Glass Victuss."
MPE1079510644,"iPad Mini A17 Pro 17 MXPP3CL/A 8.3"" 128GB azul 8GB de memoria RAM. Rating promedio: 4.5/5 basado en 2 reseñas. Reseñas: Perfecto para estudiar!!. | Este ipad que es para personas especificas. Si te gusta tomar notas como una nota pero no quieres llevar cuadernos, es una buena idea. Si quieres usarlo como lector, son ideales. La calidad de imagen es buena. La batería es buena, si quieres ser super productivo y abrir aplicaciones como ofimatica o diseño, no son para ti, mejor prueba los modelos grandes. Mas caros que el modelo base y un poco mas barato que el modelo de ipad air, creo que debes querer realmente tener este. Si estas dudando que ipad comprar, mejor revisa otros modelos. La cámara es pésima, pero creo si sabes lo que quieres de un ipad, este dato probablemente no te importe.",https://articulo.mercadolibre.com.pe/MPE-1079510644,"iPad Mini A17 Pro 17 MXPP3CL/A 8.3"" 128GB azul 8GB de memoria RAM"
MPE1079510656,"Celular Infinix GT 30 Pro Gamer 5G 256GB 12GB RAM Dual Sim Negro. Rating promedio: 4.5/5 basado en 6 reseñas. Reseñas: Llevo una semana usando el infinix gt 30 pro y hasta ahora estoy muy satisfecho. La pantalla tiene buena resolución, el rendimiento es fluido para juegos y apps, y la batería me dura todo el día. La cámara también toma fotos decentes para su precio. Por ahora, lo recomiendo como una excelente opción calidad-precio. | Es un buen celular gamer. Corre sin problemas casi todos los juegos pesados. Aunque al principio se calienta un poco , luego se estabiliza. | El celular es muy bueno, sobre todo si lo usas para jugar juegos exigentes. | Cámara: excelente.
Batería: larga duración.
Muy buen equipo. Calidad precio. | El celular es muy bueno, me gustan sus características, no me arrepiento de comprarlo, tiene muy buena pontencia a buen precio y la camara es mejor cuando hay buena iluminación. | Estoy muy alegre por comprarme este dispositivo, pero tengo algunas cosas que no me gustaron del todo la cual es su sobre calentamiento y su conexión a internet(tal vez sea por el mi operador bitel y claro con la segunda sim).
En todo lo demás en cuanto a gaming y rendimiento diario es excelente pero como ya dije actualmente con datos es odioso jugar( no se porque pasa pero al parecer es por un tema de servidores en lima).",https://articulo.mercadolibre.com.pe/MPE-1079510656,Celular Infinix GT 30 Pro Gamer 5G 256GB 12GB RAM Dual Sim Negro
MPE1079510716,"Celular Infinix Note 50 Pro 256 GB de ROM y 8 GB de RAM Dual Sim. Rating promedio: 4.5/5 basado en 10 reseñas. Reseñas: Gratamente sorprendido con el equipo, la calidad del equipo, la cámara, lo fluido del sistema. No soy gammer, pero para un uso cotidiano es la mejor relación calidad precio que he tenido en muchísimo tiempo. | Muy buen producto, bastante recomendado. | Se siente muy bien, de buena calidad, muy fluido, buena camara, lo unico detalle a mi agrado es que vibra el altavoz , como tiene dos salidas. Por lo demás excelente. | Cámara: muy buena camara.
Diseño: muy bien diseño. | Diseño: muy bueno agradable al tacto.
Batería: dura lo suficiente y carga muy rápido.
Es muy bueno. | Buen producto por su precio, aún lo estoy probando pero no decepciona<:. | Cámara: cuenta con ia para las fotos.
Batería: carga rápida. | Excelente producto, calidad precio.",https://articulo.mercadolibre.com.pe/MPE-1079510716,Celular Infinix Note 50 Pro 256 GB de ROM y 8 GB de RAM Dual Sim
MPE1079640764,"Celular Samsung Galaxy S26 Ultra 512 GB White. Rating promedio: 4.6/5 basado en 29 reseñas. Reseñas: Diseño: exelente, peso ligero , muy buenos.
Cámara: excelente.
Muy buen material, exelente precio y calidad. | Cámara: camaras excelentes y más si usas el modo pro.
Pantalla: pantalla: excelente y con mucha calidad.
Equipo altamente recomendado llevo usándolo casi 1 semana y la batería me dura casi 2 días, el teléfono es super fluido, no se calienta y el tema de la ia está por encima de todos los teléfonos. | Pantalla: de las mejores.
Diseño: de alta calidad. | Buen equipo, se siente resistente y compacto, diseño elegante y confiable. | Cámara: un éxito.
Diseño: lo mejor.
10/10. | Excelente equipo, funciones muy buenas y diseño increíble. | Diseño: ligero.
Batería: regular.
Cumple. | Es espectacular.",https://articulo.mercadolibre.com.pe/MPE-1079640764,Celular Samsung Galaxy S26 Ultra 512 GB White
MPE1079640990,"Smartphone Honor X5c Plus 6gb+256gb Dual Sim Color Blanco. Rating promedio: 5.0/5 basado en 3 reseñas. Reseñas: A mi mamá le encantó, le parece mucho mejor que un samsung a13 tenía. | Muy buen producto, calidad precio.",https://articulo.mercadolibre.com.pe/MPE-1079640990,Smartphone Honor X5c Plus 6gb+256gb Dual Sim Color Blanco
MPE1079641582,"Nokia 105 4G 128 MB negro 48 MB RAM. Rating promedio: 4.8/5 basado en 12 reseñas. Reseñas: Por confiar en la marca nokia pagué capricho. Este teléfono tiene lo basico de un teléfono normal. No encontré el 110 4g (que lo buscaba como loco por lo mismo pero que sí tiene lector de tarjetas para escuchar mi música). | Cumple todas las expectativas, mi padre tiene problemas de audición y los tonos son super altos y le permite escuchar, gracias totales. | Buen producto nokia, mi abuelita está feliz. | El celular fue para mí bisabuela, y la batería nos dura una semana, solo hay que tener cuidado con el radio que se activa rápido y se puede gastar la batería. | Teléfono basico y funcional, cumple su función principal y su bateria buena. | Similar al nokia 110.
Con con más duracion de batería 🔋 y cuenta con 4g.",https://articulo.mercadolibre.com.pe/MPE-1079641582,Nokia 105 4G 128 MB negro 48 MB RAM
MPE1079645476,"Xiaomi Redmi Note 15 4g 256gb 8gb Ram Dual Sim Negro. Rating promedio: 4.6/5 basado en 22 reseñas. Reseñas: Al segundo día de uso después de haber recibidor mi redmi note 15 4g si ninguna novedad, está funcionando muy bien y hasta el momento es un buen producto.
La crítica que tengo es que tardó un semana en llegar a mis manos. | Batería: la batería me dura más de 12 horas con uso moderado.
Pantalla: la pantalla se ve muy bien incluso de día.
Es uno de los mejores teléfonos precio calidad por su cámara y su pantalla. | Diseño: bonito.
Cámara: para su precio están muy buenas.
Excelente teléfono para el costo. Lo único que queda algo justo sería su procesador. Pero por lo demás todo bien. | Muy bueno y a excelente precio. | Muy buen celular, y la relación calidad precio es excelente. | Buen producto, como recien nuevo no le puedo dar 5 estrella en que tan duradero es, lo demás perfecto. | Pantalla: exelente brillo, bien fluido.
Cámara: fotos decentes para el precio.
Un buen celular, para los que buscan algo cómodo, bonito y practico. | Estoy satisfecho con mi compra, si bien tengo poco tiempo con este teléfono, este ha superado mis expectativas y ha sido una gran mejora a la hora de navegar por internet sin mencionar su gran capacidad de almacenamiento e ram.",https://articulo.mercadolibre.com.pe/MPE-1079645476,Xiaomi Redmi Note 15 4g 256gb 8gb Ram Dual Sim Negro
MPE1080125132,"Apple iPhone 13 128 GB Medianoche. Rating promedio: 4.7/5 basado en 155 reseñas. Reseñas: Llevo casi un año con este celular, lo único malo es que la calidad de la batería ha bajado demasiado. He conversado con otras personas que tienen iphone y me indican que no es normal. | Producto original nuevo y sellado, totalmente confiable. | Sí bastante bonito bien y otra cosa que recalienta mucho. | Buen dispositivo ,ya llevo 6 meses usándolo y funciona de maravilla ,sin ninguna falla,si tienes dudas al adquirirlo ,te digo que es 100% original,viene en su cajita con el cargador y todo buen sellado. 10/10 🤙🏻. | Sellado y sin fecha de activación, buen precio y buena calidad 5 estrellas 👍. | Todo ok, conforme. | En mi consideración este es uno de los mejores iphone con todo los problemas del 11 y 12 solucionados. Es muy similar al 14 y cumple super bien con todas las funciones. | Excelente, es iphone no hay mas que decir :).",https://articulo.mercadolibre.com.pe/MPE-1080125132,Apple iPhone 13 128 GB Medianoche
MPE1080126300,"Apple iPhone 15 (128 GB) - Azul. Rating promedio: 4.5/5 basado en 239 reseñas. Reseñas: Buen producto, solo consultar antes si es la versión china o americana. | Original y nuevo, muy bueno, pero doy 4 estrellas porque quise usar esim y resulta que este iphone 15 es de la región de china donde solo admiten 2 chip físicos y sin esim, pero después sastisfecho con este excelente iphone. | Aún no lo uso del todo porque me pedí su case y protector por china pero veo que es original. Ya pude loguearme y verificar que tiene la garantía internacional de apple. Lo que si me sorprendió es que es el modelo chino, igual es original. Un buena compra comparando que por pequeñas diferencias cómo el nombre de wifi o el doble sim, en tiendas oficiales el iphone 15 cuesta 4500 soles y aquí esta a 3000 soles aproximadamente. | Se están equivocando chicos, el iphone no es de origen chino, si no, de la india. Todo ok hasta el momento. | Lo compré a final de noviembre 2024 y hoy por hoy puedo decir que fue una gran compra. Estuve esperando un poco de tiempo por si presentaba alguna falla, pero de momento todo muy bien. | No pude conectar con esim claro. Me cambie a entel y si agarro el esim. | Buen producto, es la versión de china. | La caja vino dañada, pero el producto nuevo y sellado, recomendado.",https://articulo.mercadolibre.com.pe/MPE-1080126300,Apple iPhone 15 (128 GB) - Azul
MPE1080126792,"Tablet Honor Pad X7 4gb Ram 128gb Rom Space Gray Gris. Rating promedio: 4.8/5 basado en 9 reseñas. Reseñas: Ideal para niños. | Excelente producto!!. | Cálida precio solo para uso cotidiano , nada de juegos pesados no se estanquen. | Recomendando para uso básico, excelente para niños!. | Ta buena la tablet por suprecio, aunque es difícil de encontrar la mica anti reflejos y sugerible comprar una mica si o si.",https://articulo.mercadolibre.com.pe/MPE-1080126792,Tablet Honor Pad X7 4gb Ram 128gb Rom Space Gray Gris
MPE1080128768,"Samsung Galaxy S24 Fe Dual Sim 8gb Ram 256gb Interna Grafito. Rating promedio: 4.7/5 basado en 21 reseñas. Reseñas: Recién lo estoy empezando a usar vino sellado, nuevo y con garantía. El delivery tardo, pero se mantenían en contacto. El teléfono se calienta pero es propio del modelo en sí, con funda no se siente. Hasta ahora todo bien, conforme. | Un buen producto de gama alta baja, sin embargo, tiene un problema de sobrecalentamiento al utilizar las distintas aplicaciones cotidianas, pero si usas una funda no se nota. | Pantalla: hermosa pantalla se ve en mucho sol.
Batería: me dura bien , le falta mas capacidad creo yo.
Recomendado la verdad sobre todo si lo consigues en oferte. | Buen producto, es liviano y por el precio es excelente. | Muy buen producto, cumple con todas las funciones de samsung. | Buen producto, lo malo es su procesador, calienta mucho!. | Samsung es buena marca. Buen producto. | Muy buen equipo.",https://articulo.mercadolibre.com.pe/MPE-1080128768,Samsung Galaxy S24 Fe Dual Sim 8gb Ram 256gb Interna Grafito
MPE1080129376,Celular Honor X6b Plus 256 Gb 8gb Ram Verde Foresta. Rating promedio: 5.0/5 basado en 1 reseñas. Reseñas: Muy lindo equipo y muy eficiente!!.,https://articulo.mercadolibre.com.pe/MPE-1080129376,Celular Honor X6b Plus 256 Gb 8gb Ram Verde Foresta
MPE1080131058,"iPad Pro 11 M5 Wi-fi 256gb. Rating promedio: 4.9/5 basado en 8 reseñas. Reseñas: La caja tenía algunas marcas de arañazos, pero el ipad perfecto. | Lo mejor de lo mejor!!. | Excelente i pad, estoy encantado con su funcionamiento. | Excelente producto. | El producto llegó en perfecto estado y está 10/10. | Cumple con lo que indica.",https://articulo.mercadolibre.com.pe/MPE-1080131058,iPad Pro 11 M5 Wi-fi 256gb
MPE1080146306,"Apple iPhone 15 Pro (256 GB) - Titanio Natural - Bueno (Reacondicionado). Rating promedio: 4.0/5 basado en 5 reseñas. Reseñas: Batería: muy buena.
Todo bien muy bien con el teléfono. | Buena calidad 0 detalles. | Cámara: la camara esta 10/10.
Pantalla: pantalla 10/10.
Me vino con 100% de capacidad de bateria y todo muy bien. | Está bien el iphone me vino con 87% de batería y no tenía ningún detalle respecto a algún rayón o algo pero si no me gustó como vino ya que solo le pusieron como una bolsita y en un caja sentí que se pudo maltratar pero después todo correcto , mejorar el empaque y yap. | Se reinicia solo, al día como 6 veces cada 3 horas aproximadamente.",https://articulo.mercadolibre.com.pe/MPE-1080146306,Apple iPhone 15 Pro (256 GB) - Titanio Natural - Bueno (Reacondicionado)
MPE1080146934,"Apple iPad Air 11'' Wi-Fi 128gb Púrpura. Rating promedio: 5.0/5 basado en 8 reseñas. Reseñas: Se nota la calidad del producto!! encantando con el producto y a un precio sin competencia frente a otras tiendas!!.
Gracias!. | Pues es apple todo bien !. | Muy buen equipo. Recomendado. | Un excelente equipo, recibido original en caja sellada. | Producto lo compré para mi hermano y es ideal porque satisface todas sus necesidades universitarias que tiene. 100% recomendado. | Llegó en perfecto estado el producto. Excelente compra. | Llegó bien sellado el producto, de fácil uso y configuración. | Me gusta mucho. Es práctico y puedo realizar mis trabajos seglares normal.",https://articulo.mercadolibre.com.pe/MPE-1080146934,Apple iPad Air 11'' Wi-Fi 128gb Púrpura
MPE1080149404,"Realme Cseries C21Y Dual SIM 64 GB cross black 4 GB RAM. Rating promedio: 5.0/5 basado en 1 reseñas. Reseñas: Muy buen equipo, recomendado.",https://articulo.mercadolibre.com.pe/MPE-1080149404,Realme Cseries C21Y Dual SIM 64 GB cross black 4 GB RAM
MPE1080150712,"Moto G06 4+256gb Naranja. Rating promedio: 4.7/5 basado en 10 reseñas. Reseñas: Batería: buena duración 5100mah.
Cámara: bien.
Si estás buscando un cel bueno bonito y barato ps es este. Aunque ahora piden más detalles para crean una cuenta de google e instalar un app. Allí vas a encontrar detalles bueno será cosa de hoy en día con el control parental. | Que muy bueno y 💯 recomendado. | Pantalla: buena.
Cámara: decente.
Buen equipo. | Cumple con lo descrito, muy bueno. | Cámara: bueno para el precio.
Pantalla: buen brillo, vino con su protector de vidrio incluído.
Buen resultado para el precio. | Todo bien, pero a la vez me siento desepsionado por no decir otra palabra. Ya que no llegó con una de las caracteristica mas importante e interes para mí (no es dual sim como esta en la pagina de la descripción del producto. | Bastante bueno la batería.
Brillo excelente. | Batería: excelente. Dos días de uso ya y me queda un 30%.
Cámara: cumple en lo básico.",https://articulo.mercadolibre.com.pe/MPE-1080150712,Moto G06 4+256gb Naranja
MPE1080167346,"MacBook Air de 13 pulgadas: chip M5, CPU de 10 núcleos, GPU de 10 núcleos, Neural Engine de 16 núcleos, 1 TB - Medianoche. Rating promedio: 4.5/5 basado en 2 reseñas. Reseñas: Llegó en el mismo día de mi compra, me encanta!!. | Me encantó el producto, solo que no especifica que el teclado está en inglés.",https://articulo.mercadolibre.com.pe/MPE-1080167346,"MacBook Air de 13 pulgadas: chip M5, CPU de 10 núcleos, GPU de 10 núcleos, Neural Engine de 16 núcleos, 1 TB - Medianoche"
MPE1080167652,"Honor X6c 4g 6,61 256gb 6gb Ram Cámara 50mpx - White. Rating promedio: 4.4/5 basado en 5 reseñas. Reseñas: Muy bonito el teléfono, cumple con lo que se indica. | Llegó sin problemas y es tal cual lo pedí. | La interfaz es lenta, la calidad del celular buena. | Es bueno, pero lo sentí un poco lento bueno para la gama que es se puede decir que es pasable.",https://articulo.mercadolibre.com.pe/MPE-1080167652,"Honor X6c 4g 6,61 256gb 6gb Ram Cámara 50mpx - White"
MPE1080170942,Tablet Samsung Galaxy Tab A9 Sm-x115 4+64 Lte Chip Color Gris Oscuro. Rating promedio: 3.0/5 basado en 1 reseñas. Reseñas: El producto es de 8pulgadas y el procesamiento es un poco limitado.,https://articulo.mercadolibre.com.pe/MPE-1080170942,Tablet Samsung Galaxy Tab A9 Sm-x115 4+64 Lte Chip Color Gris Oscuro
MPE1080171326,"Celular Xiaomi Poco X8 Pro 8gb Ram 512gb Rom Dual Sim 6.59 Amoled Dimensity 8500 Ultra White. Rating promedio: 5.0/5 basado en 15 reseñas. Reseñas: Tal como se especificó. | Cámara: buena.
Pantalla: resolución muy buena.
Execelente relación precio - calidad. | Batería: muy buena batería y carga súper rápido.
Cámara: cumple pero no es su fuerte.
Es un teléfono que le corre todo, no está enfocado a que tome las mejores fotos pero en cuanto a fluidez de apps o juegos va muy sobrado.
Además esta versión de 512 y 12 ram es muy rápido, el interfaz va bien y las opciones de personalización te permiten mejorar el uso y rendimiento.
En mi opinión es uno de los mejores gama media y su precio relación precio calidad es la mejor, por lo que pagas no creo que haya alguno otro que lo supere.
Yo soy usuario de ios y este equipo lo uso como teléfono de trabajo y me va muy bien. | Excelente equipo, tiene un buen tamaño y peso. La cámara es decente, el rendimiento del equipo es buenísimo y la batería le dura un montón. Además, no tiene un montón de cámaras y el módulo sobresale lo justo; incluye una funda. | Pantalla: colores.
Cámara: videos.
Cumple con todos sus descripciones es un 10/10. | Cámara: las fotos son buenas, aunque el dispositivo no está enfocado en ello, pero el tema de la cámara de video sí mejora mucho.
Pantalla: la pantalla es buena, buenos colores y sensibilidad.
Que es la mejor opción de calidad precio, el modelo de 12 gb sin dudas lo deben de comprar, es una buena opción para quienes hacen tareas pesadas o lo quieren para jugar, corre muchos juegos a buena calidad en todo aspecto. | Exelente producto, todo en orden con la compra , tiene para rato este telefono. | Pantalla: bien.
Diseño: bien.
Bien.",https://articulo.mercadolibre.com.pe/MPE-1080171326,Celular Xiaomi Poco X8 Pro 8gb Ram 512gb Rom Dual Sim 6.59 Amoled Dimensity 8500 Ultra White
MPE1080303122,"Tablet Lenovo Idea Tab Mediatek Dimensity 6300 8gb 256gb 11 2.5k + Teclado Y Lápiz. Rating promedio: 5.0/5 basado en 2 reseñas. Reseñas: La tablet está perfecta, llegó el paquete sin abolladura, funciona muy bien, suficiente para mi pequeña de nivel escolar, este modelo es compatible red movil, tiene una ranura para ponerle tarjeta sim (chip), para tener comunicación con hijos menores.
También es suficiente para nivel universitario no muy exigente, para realizar documentos, trabajos de ofimatica, para multimedia como ver peliculas, youtube, streaming, etc. , y uno que otro juego. | Bastante buena, material resistente y conforme todo.",https://articulo.mercadolibre.com.pe/MPE-1080303122,Tablet Lenovo Idea Tab Mediatek Dimensity 6300 8gb 256gb 11 2.5k + Teclado Y Lápiz
MPE1080732172,"iPad air De 13 pulgadas Wi-fi 128 gb - Morado (m4). Rating promedio: 4.6/5 basado en 10 reseñas. Reseñas: Llegó todo okey con su boleta bien sellado. | Todo increíble con el producto. Original, con garantía y conforme a lo que pedí. Maravilloso 😻. | Llegó todo bien, producto nuevo y sellado. | Excelente y bastante útil para el trabajo de día, su sistema operativo es bastante amigable y fácil de usar, lo q si es un detalle es la batería q suele durar menos de un día si le das full uso todo el día, pero si eres de usarlo unas cuantas veces al día te dura normal más tiempo. | Todo correcto, llegó rápido y funciona bien. Tal cual la descripción. | Todo como lo esperaba. | El ipad inicia en bucle y sale mensaje de error.",https://articulo.mercadolibre.com.pe/MPE-1080732172,iPad air De 13 pulgadas Wi-fi 128 gb - Morado (m4)
MPE1080825138,"Tableta Xiaomi Redmi Pad 2 128gb 4 Ram Wi-fi Color Verde Verde. Rating promedio: 5.0/5 basado en 2 reseñas. Reseñas: Totalmente conforme con el producto. | Muy buena❤️ la amé, la batería dura bastante tiempo, me funciona muy bien.",https://articulo.mercadolibre.com.pe/MPE-1080825138,Tableta Xiaomi Redmi Pad 2 128gb 4 Ram Wi-fi Color Verde Verde
MPE1080827860,"Apple Ipad 11 A3354 Wi-Fi 128gb y 6GB RAM Color Azul. Rating promedio: 5.0/5 basado en 25 reseñas. Reseñas: Excelente producto. Calidad y precio. | Me encantó amo mi ipad 100% la uso todo el día para el trabajo u otros. | Buena compra, solo tuve el problema al principio porque en el wallet se quedaba girando. Luego averigüé que era un problema generalizado que se solucionaba conectando el cargador (esto únicamente en la configuración inicial del equipo) por lo demás muy buena compra. | Llegó perfecto y al día siguiente de la compra. | Buen producto y a buen precio. Muy buena oferta.
Gracias mercado libre perú. | Es original, muy bien empaquetado, sin daños la caja del ipad, me gusto para su precio está muy bien. | Me llegó bien y en el tiempo indicado. | Muy buena calidad.",https://articulo.mercadolibre.com.pe/MPE-1080827860,Apple Ipad 11 A3354 Wi-Fi 128gb y 6GB RAM Color Azul
MPE1080840558,Galaxy A57 256gb Awesome Gray. Rating promedio: 5.0/5 basado en 1 reseñas. Reseñas: Si recibí el producto.,https://articulo.mercadolibre.com.pe/MPE-1080840558,Galaxy A57 256gb Awesome Gray
MPE1080840620,"Teléfono celular Samsung Galaxy A57 5G 256gb, 8gb Ram, características Ai Lilac. Rating promedio: 5.0/5 basado en 1 reseñas. Reseñas: Excelente telefono, el mejor de la gama media, no me permite crear samsung acount, supongo que es un error, pero de resto muy bien.",https://articulo.mercadolibre.com.pe/MPE-1080840620,"Teléfono celular Samsung Galaxy A57 5G 256gb, 8gb Ram, características Ai Lilac"
MPE1080841218,Notebook Asus Expertbook P1 15.6 PuLG Fhd Tn Core I5 13 16gb Gris. Rating promedio: 4.0/5 basado en 1 reseñas. Reseñas: Buen producto lo único es el tiempo de batería pero se entiendo por el tipo de procesador que utiliza no es de alto rendimiento energético pero eso también ayuda a que la laptop procese más tareas rápidamente.,https://articulo.mercadolibre.com.pe/MPE-1080841218,Notebook Asus Expertbook P1 15.6 PuLG Fhd Tn Core I5 13 16gb Gris
MPE1080853328,"Teléfono celular Samsung Galaxy A57 5G 256gb 8gb Ram Blue. Rating promedio: 5.0/5 basado en 1 reseñas. Reseñas: Excelente telefono, el mejor de la gama media, no me permite crear samsung acount, supongo que es un error, pero de resto muy bien.",https://articulo.mercadolibre.com.pe/MPE-1080853328,Teléfono celular Samsung Galaxy A57 5G 256gb 8gb Ram Blue
MPE1080853610,"Celular Unnecto Bolt 1 Dual Sim 32gb/2gb Naranja. Rating promedio: 5.0/5 basado en 1 reseñas. Reseñas: Buen equipo para cosas basicas como whatsapp. La cámara no es de buena calidad, pero el precio del equipo es barato.",https://articulo.mercadolibre.com.pe/MPE-1080853610,Celular Unnecto Bolt 1 Dual Sim 32gb/2gb Naranja
MPE1080864110,"iPhone 13 Pro Max 128 GB azul sierra - Excelente (Reacondicionado). Rating promedio: 3.0/5 basado en 2 reseñas. Reseñas: Todo excelente con el telefono impecable, solo la batería al 86% pero todo 10/10 y la atención tambien excelente. Muchas gracias. | No pasa nada los repuestos que fueron refaccionado se malograron en 2 meses pantalla y bateria.",https://articulo.mercadolibre.com.pe/MPE-1080864110,iPhone 13 Pro Max 128 GB azul sierra - Excelente (Reacondicionado)
MPE1080864680,"Galaxy Tab S10 Fe 8gb 128gb Gris. Rating promedio: 3.0/5 basado en 2 reseñas. Reseñas: Tal cual se muestra, totalmente funcional para mis actividades académicas. Excelente. | El producto me llegó dañado, exijo una solución inmediata pero no me da soluciones. Esto esta afectando los fines que tenia planeado el uso de la tablet.",https://articulo.mercadolibre.com.pe/MPE-1080864680,Galaxy Tab S10 Fe 8gb 128gb Gris
MPE1080869816,"Honor 400 12 GB Ram 256 GB ROM Negro. Rating promedio: 4.5/5 basado en 23 reseñas. Reseñas: Excelente celular, excelente cámara, muy rápido y la ia excelente. | Excelente el producto llegó antes de lo esperado, está funcionando correctamente hasta el momento muchas gracias. | Excelente, cumple con todas mis expectativas. | El producto 10/10, todo bonito, desde la caja hasta el propio celular, lo recomiendo muchísimo, para la oferta que me dieron, estoy super feliz, muchas gracias. | Todo muy bien hasta ahora!!! tal cual la imagen!. | Llegó bien, salvo por un detalle en la caja pero el celular estaba en buen estado y funciona bien. | Super bueno la batería dura mucho. | Buen celular , no hay pierde.",https://articulo.mercadolibre.com.pe/MPE-1080869816,Honor 400 12 GB Ram 256 GB ROM Negro
MPE1080914392,"Xiaomi Redmi 15c 8gb Ram 256gb Dual Sim 50mp Huella Fm Dimm Azul. Rating promedio: 4.6/5 basado en 48 reseñas. Reseñas: Excelente producto precio calidad. | Cámara: videos.
Diseño: peso.
Excelente movil. | Bueno calidad precio muy bien. | Lo compre para uso de mi madre y cumple lo requerido. | Es un buen celular , buena marca que responde bien, ya lo conozco. Y carga rápido. !. | Batería: muy buena duracion.
Cámara: cámara buena.
Excelente equipo. | Equipo calidad/precio.
Recomendado. | Todo ok, producto nuevo y cumple con las especificaciones.",https://articulo.mercadolibre.com.pe/MPE-1080914392,Xiaomi Redmi 15c 8gb Ram 256gb Dual Sim 50mp Huella Fm Dimm Azul
